{
    "$schema": "../skin_schema.json",
    "author": "Drewol",
    "game_version": [
        0,
        4,
        0
    ],
    "name": "Default",
    "permissions": [
        "file"
    ],
    "settings": [
        "Gameplay",
        {
            "name": "earlate_position",
            "type": "selection",
            "label": "Early/Late display position",
            "default": "bottom",
            "values": [
                "bottom",
                "middle",
                "top",
                "off"
            ]
        },
        {
            "name": "nick",
            "type": "text",
            "label": "Display name",
            "default": "Guest"
        },
        {},
        "Song select",
        {
            "name": "show_guide",
            "label": "Show control guide on song select",
            "type": "bool",
            "default": true
        },
        {},
        "Result",
        {
            "name": "show_result_hiscore",
            "label": "Show hiscore on result",
            "type": "bool",
            "default": true
        },
        {
            "name": "hit_graph_delta_scale",
            "label": "Hit graph scale (y-axis)",
            "type": "float",
            "default": 0.8,
            "max": 3.0,
            "min": 0.5
        },
        {
            "name": "show_result_guide",
            "label": "Show control guide on result",
            "type": "bool",
            "default": true
        },
        {
            "name": "show_detailed_results",
            "label": "Show detailed results by default",
            "type": "bool",
            "default": false
        },
        {
            "name": "show_result_icons",
            "label": "Show icons related to play settings at the bottom",
            "type": "bool",
            "default": true
        },
        {
            "name": "ir_or_hiscore",
            "label": "Show IR by default in place of hiscore",
            "type": "bool",
            "default": false
        },
        {},
        "Test objects",
        {
            "name": "Testing with space",
            "type": "float",
            "label": "Test setting with spaces in the key",
            "default": 50.0,
            "max": 100.0,
            "min": -100.0
        },
        {
            "name": "Ineger_test",
            "type": "integer",
            "label": "Integer Test with range -100<->100",
            "default": 50,
            "max": 100,
            "min": -100
        },
        {
            "name": "col_test",
            "type": "color",
            "label": "Color Test",
            "default": "007FFFFF"
        },
        {
            "name": "secret_value",
            "type": "text",
            "label": "Secret value test",
            "default": "usc123",
            "secret": true
        }
    ],
    "version": [
        0,
        4
    ],
    "website": "https://github.com/Drewol/unnamed-sdvx-clone"
}